A2: ASSOCIAZIONE CULTURALE LA COLOMBERA
A3: Via Locatelli - 24040 OSIO SOPRA (BG)
A4: C.F. 95108370164 - P.IVA 02722270168
A6: SCUOLA CIVICA DI ARTE E MUSICA DI OSIO SOPRA
A7: BILANCIO ABBATTIMENTO RETTE Anno Scolastico 2007/2008
A9: RICAVI
A10: RETTE FREQUENZA | J10: =SUM(H12:H14) -> 39811.666666666672
G11: Lordo | H11: Netto
A12: Rette frequenza - I rata | G12: 16555 | H12: =G12/1.2 -> 13795.833333333334
A13: Rette frequenza - II rata | G13: 15163 | H13: =G13/1.2 -> 12635.833333333334
A14: Rette frequenza - III rata | G14: 16056 | H14: =G14/1.2 -> 13380
A15: RIPORTO DA BILANCIO ABBATTIMENTO RETTE 2006/2007 | J15: 1026.11
A16: DA BILANCIO GESTIONE SCUOLA PER SCONTO BANDA MARIANO | J16: 355
A17: DA BILANCIO GESTIONE SCUOLA PER Coordinamento | J17: =SUM(H18:H19) -> 1122.24
A18: Retribuzione lorda | H18: 1008
A19: Contributi Inps | H19: 114.24
A20: CONTRIBUTI COMUNALI IN ACCONTO | J20: =SUM(H21:H22) -> 17292.974999999999
A21: Contributo Comunale Novembre 2007 (fattura IVA escl) | G21: 6522.11 | H21: =G21/1.2 -> 5435.0916666666662
A22: Contributo Comunale Febbraio 2008 Fattura IVA escl) | G22: 14229.46 | H22: =G22/1.2 -> 11857.883333333333
A23: TOTALE RICAVI | J23: =SUM(J10:J22) -> 59607.991666666669
A25: COSTI
A26: COMPENSI LORDI EROGATI AI DOCENTI (+ Coordinamento) | J26: =SUM(H27:H29) -> 51318
A27: RETRIBUZIONI DOCENTI Dic. 2007 | H27: 18030.6
A28: RETRIBUZIONI DOCENTI Feb. 2008 | H28: 11314.8
A29: RETRIBUZIONI DOCENTI Mag. 2008 | H29: 21972.6
A30: CONTRIBUTI INPS A CARICO ASSOCIAZIONE | J30: =SUM(H31:H33) -> 6056.98
A31: CONTRIBUTI INPS 12/2007 | H31: 2077.88
A32: CONTRIBUTI INPS 02/2008 | H32: 1456.91
A33: CONTRIBUTI INPS 05/2008 | H33: 2522.19
A34: IMPOSTE E TASSE | J34: =SUM(H35:H39) -> 2870.5535481250004
A35: IRAP 4,25% su Imponibile Previdenziale compensi docenti | H35: =J26*(4.25/100) -> 2181.0149999999999
A36: IRPEG su rette di frequenza (3/100*36/100) | H36: =J10*3/100*36/100 -> 429.96600000000007
A37: IRAP su rette di frequenza (3/100*4,25/100) | H37: =J10*3/100*4.25/100 -> 50.759875000000001
A38: IRPEG su contributi comunali gestione corsi (3/100*36/100) | H38: =J20*3/100*36/100 -> 186.76412999999997
A39: IRAP su contributi Comunali per gestione corsi (3/100*4,25/100) | H39: =J20*3/100*4.25/100 -> 22.048543124999995
A40: TOTALE COSTI | J40: =SUM(J26:J39) -> 60245.533548124993
A43: RIEPILOGO
D46: RICAVI | E46: =SUM(J23) -> 59607.991666666669 | F46: COSTI | H46: COSTI | J46: =SUM(J40) -> 60245.533548124993
A48: CONTRIBUTO COMUNALE A SALDO | E48: =J46-E46 -> 637.5418814583245
A51: Totale contributo comunale | E51: =J15+J20+E48 -> 18956.626881458324 | F51: =E51*100/J46 -> 31.465613739341357 | G51: =E51*100/J46 -> 31.465613739341357