A1: ASSOCIAZIONE CULTURALE LA COLOMBERA
A2: Via Locatelli - 24040 OSIO SOPRA (BG)
A3: C.F. 95108370164 - P.IVA 02722270168
A4: SCUOLA CIVICA DI ARTE E MUSICA DI OSIO SOPRA
A5: SPESE FISSE DI GESTIONE Anno Scolastico 2007/2008
A7: RICAVI
A8: RIPORTO DA BILANCIO SPESE FISSE DI GESTIONE 2006/2007 | K8: 338.22
A9: CONTRIBUTO COMUNALE | K9: =SUM(I10:I11) -> 8537.7
A10: Contributo Comunale Novembre 2007 (fattura IVA escl) | G10: 3436.16 | H10: 20 | I10: =G10/1.2 -> 2863.4666666666667
A11: Contributo Comunale Febbraio 2008 Fattura IVA escl) | G11: 6809.08 | H11: 20 | I11: =G11/1.2 -> 5674.2333333333336
A12: TOTALE RICAVI | K12: =SUM(K8:K11) -> 8875.92
A14: COSTI
A15: MATERIALI E PREST. PER CORSI | G15: Lordo | H15: Iva | I15: Netto | K15: =SUM(I16:I21) -> 858.33333333333348
A16: Ricambi batteria | G16: 70 | H16: 20 | I16: =G16/1.2 -> 58.333333333333336
A17: Abbonamento rivista pittura | G17: 42 | H17: 20 | I17: =G17/1.2 -> 35
A18: Ricambi batteria e varie (Brambilla) | G18: 140 | H18: 20 | I18: =G18/1.2 -> 116.66666666666667
A19: Mini Mixer + 2 microfoni Shure | G19: 368 | H19: 20 | I19: =G19/1.2 -> 306.66666666666669
A20: Leggi pieghevoli | G20: 210 | H20: 20 | I20: =G20/1.2 -> 175
A21: Materiali vari pittura | G21: 200 | H21: 20 | I21: =G21/1.2 -> 166.66666666666669
A22: PUBBLICITA' e SAGGI | G22: Lordo | H22: Iva | I22: Netto | K22: =SUM(I23:I28) -> 2494.166666666667
A23: Opuscolo informativo | G23: 1500 | H23: 20 | I23: =G23/1.2 -> 1250
A24: Saggi gruppi | G24: 45 | H24: 20 | I24: =G24/1.2 -> 37.5
A25: Sala polivalente | G25: 200 | I25: =G25/1.2 -> 166.66666666666669
A26: Plebani pubblicit√† Saggi finali | G26: 300 | H26: 20 | I26: =G26/1.2 -> 250
A27: Pianoforte per saggi | G27: 348 | H27: 20 | I27: =G27/1.2 -> 290
A28: Auditorium | G28: 600 | H28: 20 | I28: =G28/1.2 -> 500
A29: Consulenza fiscale e Coordinamento | K29: =SUM(I30:I33) -> 3194.24
A30: Coordinamento didattico (lordo) | I30: 1008
A31: Coordinamento didattico (INPS Datore) | I31: 114.24
A32: Consulenza fiscale | G32: 1248 | I32: 1048
A33: Servizio Paghe | G33: 1224 | I33: 1024
A34: TELEFONICHE E POSTALI | K34: =SUM(I35:I35) -> 313
A35: Ricariche omnitel e spese postali | I35: 313
A36: SCONTO BANDA MARIANO | K36: =SUM(I37) -> 355
A37: Professionali: 4, Teoria A3: 1 | G37: 426 | H37: 20 | I37: =G37/(1+H37/100) -> 355
A38: CANCELLERIA | G38: Lordo | H38: Iva | I38: Netto | K38: =SUM(I39:I41) -> 250
A39: Nastri Dymo | G39: 22 | H39: 20 | I39: =G39/1.2 -> 18.333333333333336
A40: Cartucce originali | G40: 233 | H40: 20 | I40: =G40/1.2 -> 194.16666666666669
A41: Toner ricaricato | G41: 45 | H41: 20 | I41: =G41/1.2 -> 37.5
A42: SPESE VARIE E ATTREZZATURE | K42: =SUM(I43:I44) -> 572.5
A43: Trasporto e accordatura pianoforte a coda | G43: 348 | H43: 20 | I43: =G43/1.2 -> 290
A44: Serrature, Chiavi, mat. Pulizia, Cellulare | G44: 339 | H44: 20 | I44: =G44/1.2 -> 282.5
A45: IMPOSTE E TASSE | K45: =SUM(I46:I47) -> 103.09272750000001
A46: IRAP su contributo comuanle gestione scuola (3/100*4,25/100) | I46: =K9*3/100*4.25/100 -> 10.885567500000002
A47: IRPEG su contributo comunale gestione scuola (3/100*36/100) | I47: =K9*3/100*36/100 -> 92.207160000000002
A48: TOTALE COSTI | K48: =SUM(K15:K47) -> 8140.3327275000001
A50: RIEPILOGO
A51: TOTALE RICAVI | E51: =SUM(K12) -> 8875.92 | F51: TOTALE COSTI | K51: =K48 -> 8140.3327275000001
A52: CONTRIBUTO COMUNALE A SALDO | E52: =K51-E51 -> -735.58727249999993
A54: Totale contributo comunale | E54: =K12+E52 -> 8140.3327275000001