A1: COMUNE DI OSIO SOPRA Civica Scuola di Arte e Musica

B1: Allievi residenti | D1: Allievi non residenti
A2: Corso | B2: Minori | C2: Maggiori | D2: Minori | E2: Maggiori | G2: TOTALE
A3: Corso di Musica A Professionale | B3: 6 | D3: 3 | G3: 9
A4: Corso di Musica B1.30 Amatoriale | B4: 10 | D4: 4 | E4: 1 | G4: 15
A5: Corso di Musica B1.45 Amatoriale | B5: 24 | C5: 1 | D5: 13 | G5: 38
A6: Corso di Musica B2 Amatoriale | B6: 23 | C6: 1 | D6: 7 | E6: 1 | G6: 32
A7: Corso di Musica B3 Amatoriale | B7: 6 | C7: 1 | D7: 4 | G7: 11
A8: Solo Propedeutica | D8: 4 | G8: 4
A9: Solo Teoria e solfeggio A | B9: 1 | D9: 5 | E9: 1 | G9: 7
A10: Solo Teoria e solfeggio B | B10: 1 | D10: 2 | G10: 3
A11: Atelier Ragazzi | B11: 4 | D11: 1 | G11: 5
A12: Pittura amatoriale | B12: 1 | C12: 6 | D12: 3 | E12: 11 | G12: 21
A13: TOTALE | B13: 76 | C13: 9 | D13: 45 | E13: 14 | G13: 145

A1: Comune | B1: N. Allievi
A2: Osio Sopra | B2: 85
A3: Dalmine | B3: 34
A4: Osio Sotto | B4: 12
A5: Brusaporto | B5: 3
A6: Treviolo | B6: 3
A7: Bergamo | B7: 2
A8: Brembate | B8: 1
A9: Curnasco | B9: 1
A10: Levate | B10: 1
A11: Mozzo | B11: 1
A12: Verdellino | B12: 1
A13: Verdello | B13: 1
A15: Totale | B15: 145

A4: SCUOLA CIVICA DI ARTE E MUSICA DI OSIO SOPRA GESTIONE CORSI Anno Scolastico 2001/2002 I dati sono espressi in EURO
A6: RICAVI
A7: RETTE FREQUENZA | J7: =SUM(H8:H10) -> 31999.483333333334
A8: Rette frequenza - I rata | H8: 10682.908333333333
A9: Rette frequenza - II rata | H9: 10977.291666666668
A10: Rette frequenza - III rata | H10: 10339.283333333333
A11: RIMANENZA ANNO PRECEDENTE | J11: 2114.84
A12: CONTRIBUTI COMUNALI IN ACCONTO | J12: =SUM(H13:H14) -> 15742.38
A13: Rata Novembre 2001 | H13: 3528.7
A14: Rata Febbraio 2002 | H14: 12213.68
A15: TOTALE RICAVI | J15: =SUM(J7:J14) -> 49856.703333333338
A17: COSTI
A18: COMPENSI LORDI EROGATI AI DOCENTI | J18: =SUM(H19:H21) -> 42203.4
A19: RETRIBUZIONI DOCENTI 11/2001 | H19: 15422.44
A20: RETRIBUZIONI DOCENTI 02/2002 | H20: 15076.73
A21: RETRIBUZIONI DOCENTI 06/2002 | H21: 11704.23
A22: CONTRIBUTI INPS A CARICO ASSOCIAZIONE | J22: =SUM(H23:H25) -> 3068.09
A23: CONTRIBUTI INPS 11/2001 | H23: 1142.04
A24: CONTRIBUTI INPS 02/2002 | H24: 1145.24
A25: CONTRIBUTI INPS 06/2002 | H25: 780.81
A26: I.R.A.P. | J26: =SUM(H27) -> 1793.6444999999999
A27: I.R.A.P. 4,25% su Imponibile Previdenziale compensi docenti | H27: =J18*4.25/100 -> 1793.6444999999999
A28: TOTALE COSTI | J28: =SUM(J18,J22,J26) -> 47065.134499999993
A30: RIEPILOGO
A32: RICAVI | E32: =SUM(J15) -> 49856.703333333338 | F32: COSTI | J32: =SUM(J28) -> 47065.134499999993
A34: CONTRIBUTO COMUNALE A SALDO | E34: =J34-E34 -> -2791.5688333333455
A36: Totale contributo comunale | C36: =J11+J12+E36 -> 15065.651166666656 | D36: =E39*100/J34 -> 32.010215899131573 | E36: %

B5: SCUOLA CIVICA DI ARTE E MUSICA DI OSIO SOPRA GESTIONE AMMINISTRATIVA Anno Scolastico 2001/2002 I dati sono espressi in EURO
B7: RICAVI
B8: RIMANENZA ANNO PRECEDENTE | H8: 721.51
B9: CONTRIBUTO COMUNALE | H9: =SUM(H9:H10) -> 6477
B10: Contributo Comunale Novembre 2001 | F10: 1344.01
B11: Contributo Comunale Febbraio 2002 | F11: 5132.99
B12: CONTRIBUTO LEVATE PER GIROSTRUMENTI | H12: 235
B13: TOTALE RICAVI | H13: =SUM(J7:J11) -> 7433.51
B15: COSTI
B16: SPESE PERSONALE | H16: =SUM(H16:H19) -> 881.90287499999999
B17: Compenso per Direzione artistica | F17: 455.51
B18: IRAP relativa | F18: =H16*0.0425 -> 19.359175
B19: Compenso personale di segreteria | F19: 390.44
B20: IRAP relativa | F20: =H18*0.0425 -> 16.593700000000002
B21: SPESE PER GIROSTRUMENTI | H21: =SUM(H21:H22) -> 297.5
B22: Rimborso spese agli insegnanti | F22: 235
B23: Stampa opuscoli | F23: 62.5
B24: MATERIALI PER CORSI D'ARTE | H24: =SUM(H24:H25) -> 694.31
B25: Materiale consumo per corso pittura (Fatture) | F25: 293.06
B26: Materiale consumo per corsi di musica | F26: 401.25
B27: PUBBLICITA' E SAGGI DI FINE ANNO | H27: =SUM(H27:H30) -> 1656.54
B28: Stampa pubblicità e libretto | F28: 1382.32
B29: Spedizione libretti | F29: 45.71
B30: Libretto lezioni | F30: 52.51
B31: Volantini saggi | F31: 176
B32: ONORARI CONSULENZA FISCALE E DEL LAVORO | H32: =SUM(H32:H36) -> 1880
B33: Consulenza fiscale 3° trim.2001 | F33: 312.02
B34: Consulenza fiscale 4° trim.2001 | F34: 264.43
B35: Consulenza fiscale 1° trim.2002 | F35: 264.43
B36: Consulenza fiscale 2° trim.2002 | F36: 264.43
B37: Servizio Paghe | F37: 774.69
B38: SPESE VARIE | H38: =SUM(H38:H43) -> 790.77
B39: Portaombrelli e tappeti | F39: 89.19
B40: Spese Telefoniche Omnitel | F40: 142.03
B41: Targa Civica Scuola | F41: 215
B42: Cancelleria (Fatturate) | F42: 155.58
B43: Riparazione fotocopiatrice | F43: 116.67
B44: Accordatura pianoforte | F44: 72.3
B45: IMPOSTE E TASSE | H45: =SUM(H45:H50) -> 647.38410334999992
B46: IRAP su rette di frequenza (3/100*4,25/100) | F46: 40.799341250000005
B47: IRPEG su rette di frequenza (3/100*36/100) | F47: 345.59442000000001
B48: IRAP su contributi Comunali per gestione corsi (3/100*4,25/100) | F48: 20.071534499999999
B49: IRPEG su contributi comunali gestione corsi (3/100*36/100) | F49: 162.70903259999989
B50: IRAP su contributo comuanle gestione scuola (3/100*4,25/100) | F50: =J8*3/100*4.25/100 -> 8.2581749999999996
B51: IRPEG su contributo comunale gestione scuola (3/100*36/100) | F51: =J8*3/100*36/100 -> 69.951599999999999
B52: TOTALE COSTI | H52: =SUM(J15:J50) -> 6848.4069783500008
B54: RIEPILOGO
B56: TOTALE RICAVI | C56: =SUM(J12) -> 7433.51 | D56: TOTALE COSTI
B58: CONTRIBUTO COMUNALE A SALDO | D58: =J57-E57 -> -585.10302164999939
B60: Totale contributo comunale | D60: =J7+J8+E60 -> 6613.4069783500008