C8: BILANCIO ABBATTIMENTO RETTE
C9: Anno Scolastico 2004/2005
C10: I dati sono espressi in EURO
C11: RICAVI
C12: RETTE FREQUENZA | J12: =SUM(H14:H16) -> 42075
G13: Lordo | H13: Netto
C14: Rette frequenza - I rata | G14: 16620 | H14: =G14/1.2 -> 13850
C15: Rette frequenza - II rata | G15: 16857 | H15: =G15/1.2 -> 14047.5
C16: Rette frequenza - III rata | G16: 17013 | H16: =G16/1.2 -> 14177.5
C17: RIPORTO DA BILANCIO ABBATTIMENTO RETTE 2003/2004 | J17: -334.34
C18: DA BILANCIO GESTIONE SCUOLA PER SCONTO BANDA MARIANO | J18: 1066.67
C19: CONTRIBUTI COMUNALI IN ACCONTO | J19: =SUM(H20:H21) -> 17699.07
C20: Rata Novembre 2004 | H20: 7151.19
C21: Rata Febbraio 2005 | H21: 10547.88
C22: TOTALE RICAVI | J22: =SUM(J12:J21) -> 60506.400000000001
C24: COSTI
C25: COMPENSI LORDI EROGATI AI DOCENTI | J25: =SUM(H26:H28) -> 51812.1
C26: RETRIBUZIONI DOCENTI Dic. 2004 | H26: 16771.12
C27: RETRIBUZIONI DOCENTI Feb. 2005 | H27: 17625.85
C28: RETRIBUZIONI DOCENTI Mag. 2005 | H28: 17415.13
C29: CONTRIBUTI INPS A CARICO ASSOCIAZIONE | J29: =SUM(H30:H32) -> 4673
C30: CONTRIBUTI INPS 12/2004 | H30: 1632
C31: CONTRIBUTI INPS 02/2005 | H31: 1300
C32: CONTRIBUTI INPS 05/2005 | H32: 1741
C33: IMPOSTE E TASSE | J33: =SUM(H34:H38) -> 2923.7861452500001
C34: IRAP 4,25% su Imponibile Previdenziale compensi docenti | H34: =J25*(4.25/100) -> 2202.0142500000006
C35: IRPEG su rette di frequenza (3/100*36/100) | H35: =J12*3/100*36/100 -> 454.41
C36: IRAP su rette di frequenza (3/100*4,25/100) | H36: =J12*3/100*4.25/100 -> 53.645625000000003
C37: IRPEG su contributi comunali gestione corsi (3/100*36/100) | H37: =J19*3/100*36/100 -> 191.14995599999997
C38: IRAP su contributi Comunali per gestione corsi (3/100*4,25/100) | H38: =J19*3/100*4.25/100 -> 22.566314249999994
C39: TOTALE COSTI | J39: =SUM(J25:J38) -> 59408.886145250006
C41: RIEPILOGO
C43: RICAVI | E43: =SUM(J22) -> 60506.400000000001 | F43: COSTI | J43: =SUM(J39) -> 59408.886145250006
C45: CONTRIBUTO COMUNALE A SALDO | E45: =J45-E45 -> -1097.5138547499955
C47: Totale contributo comunale | E47: =J17+J19+E47 -> 16267.216145250004 | F47: =E50*100/J45 -> 27.381789494382964 | G47: =E50*100/J45 -> 27.381789494382964