B3: SPESE FISSE DI GESTIONE 2004/2005
B5: RICAVI
B6: RIPORTO DA BILANCIO SPESE FISSE DI GESTIONE 2003/2004 | I6: 226.56
B7: CONTRIBUTO COMUNALE | I7: =SUM(I8:I9) -> 7814.33
B8: Contributo Comunale Novembre 2004 | G8: 2201.36
B9: Contributo Comunale Febbraio 2005 | G9: 5612.97
B10: TOTALE RICAVI | I10: =SUM(K6:K9) -> 8040.89
B12: COSTI
B13: MATERIALI PER CORSI D'ARTE | E13: Lordo | F13: Iva | G13: Netto | I13: =SUM(I14:I22) -> 1015.2564102564103
B14: Pelli e ricambi batteria (Di Gioia) | E14: 205 | F14: 20 | G14: =G14/(1+H14/100) -> 170.83333333333334
B15: Mostra allievi pittura | E15: 92 | F15: 20 | G15: =G15/(1+H15/100) -> 76.666666666666671
B16: Partiture per Archivio | E16: 370 | F16: 4 | G16: =G16/(1+H16/100) -> 355.76923076923077
B17: Partiture (Maffeis) | E17: 78 | F17: 4 | G17: =G17/(1+H17/100) -> 75
B18: Rivista Art Dossier | E18: 35 | F18: 20 | G18: =G18/(1+H18/100) -> 29.166666666666668
B19: Spese colorificio per corso pittura | E19: 250 | F19: 20 | G19: =G19/(1+H19/100) -> 208.33333333333334
B20: Rivista Pittura | E20: 43 | F20: 20 | G20: =G20/(1+H20/100) -> 35.833333333333336
B21: Poggiapiedi per chitarra (Brambilla) | E21: 36 | F21: 20 | G21: =G21/(1+H21/100) -> 30
B22: Partiture (Carissimi))) | E22: 35 | F22: 4 | G22: =G22/(1+H22/100) -> 33.653846153846153
B23: PUBBLICITA' e SAGGI | E23: Lordo | F23: Iva | G23: Netto | I23: =SUM(I24:I27) -> 2087.6
B24: Opuscolo di inizio anno | E24: 1077.12 | F24: 20 | G24: =G24/(1+H24/100) -> 897.6
B25: Auditorium | E25: 600 | F25: 0 | G25: =G25/(1+H25/100) -> 600
B26: Casa ad archi | E26: 240 | F26: 0 | G26: =G26/(1+H26/100) -> 240
B27: Noleggio pianoforte per saggi | E27: 420 | F27: 20 | G27: =G27/(1+H27/100) -> 350
B28: ONORARI CONSULENZA FISCALE E DEL LAVORO | I28: =SUM(I29:I30) -> 2448
B29: Consulenza fiscale | G29: 1248
B30: Servizio Paghe | G30: 1200
B31: TELEFONICHE E POSTALI | I31: =SUM(I32:I32) -> 260
B32: Ricariche omnitel e spese postali | G32: 260
B33: SCONTO BANDA MARIANO | I33: =SUM(I34:I34) -> 1066.6666666666667
B34: 8 Teoria, 4 B.30 (sconto), 2 A e 2A (sconto) | E34: 1280 | F34: 20 | G34: =G34/(1+H34/100) -> 1066.6666666666667
B35: SPESE VARIE | E35: Lordo | F35: Iva | G35: Netto | I35: =SUM(I36:I39) -> 1034.875
B36: Cancelleria | E36: 765 | F36: 20 | G36: =G36/(1+H36/100) -> 637.5
B37: Accordatura pianoforti | E37: 286 | F37: 20 | G37: =G37/(1+H37/100) -> 238.33333333333334
B38: Cassetta Pronto Soccorso | E38: 107.35 | F38: 20 | G38: =G38/(1+H38/100) -> 89.458333333333329
B39: Serrature, chiavi e varie | E39: 83.5 | F39: 20 | G39: =G39/(1+H39/100) -> 69.583333333333343
B40: IMPOSTE E TASSE | I40: =SUM(I41:I42) -> 94.358034750000002
B41: IRAP su contributo comuanle gestione scuola (3/100*4,25/100) | G41: =K7*3/100*4.25/100 -> 9.9632707499999995
B42: IRPEG su contributo comunale gestione scuola (3/100*36/100) | G42: =K7*3/100*36/100 -> 84.394763999999995
B43: TOTALE COSTI | I43: =SUM(K13:K42) -> 8006.7561116730776
B45: RIEPILOGO
B46: TOTALE RICAVI | C46: =SUM(K10) -> 8040.89 | D46: TOTALE COSTI | I46: =K43 -> 8006.7561116730776
B47: CONTRIBUTO COMUNALE A SALDO | C47: =K46-E46 -> -34.133888326922715
B49: Totale contributo comunale | C49: =K10+E47 -> 8006.7561116730776