A1: COMUNE DI OSIO SOPRA Civica Scuola di Arte e Musica

A1: Corso | B1: Allievi residenti | D1: Allievi non residenti | F1: TOTALE
B2: Minori di 21 anni | C2: Maggiori di 21 anni | D2: Minori di 21 anni | E2: Maggiori di 21 anni
A3: Corso di Musica A Professionale | B3: 14 | D3: 10 | F3: 24
A4: Corso di Musica B.30 Amatoriale | B4: 7 | D4: 11 | F4: 18
A5: Corso di Musica B.45 Amatoriale | B5: 36 | C5: 2 | D5: 26 | E5: 2 | F5: 66
A6: Corso di Musica B.60 Amatoriale | B6: 1 | D6: 2 | F6: 3
A7: Solo Propedeutica e Teoria | B7: 3 | D7: 18 | F7: 21
A8: Solo Musica d’insieme | B8: 2 | D8: 4 | F8: 6
A9: Atelier Ragazzi | B9: 5 | F9: 5
A10: Pittura | B10: 1 | C10: 6 | E10: 14 | F10: 21
A11: Corso teatro | E11: 2 | F11: 2
A12: TOTALE | B12: 69 | C12: 8 | D12: 71 | E12: 18 | F12: 166
B13: 77 | D13: 89

B1: Consuntivo | C1: Già versato da Amministrazione | D1: Saldo a carico amministrazione
A2: Abbattimento rette | B2: 18.178,27 | C2: 17.843,93 | D2: 334,34
A3: Gestione Scuola | B3: 6.474,46 | C3: 6.697,02 | D3: - 222,56
A4: Totale | B4: 24.652,73 | C4: 24.540,95 | D4: 111,78

A2: ASSOCIAZIONE CULTURALE LA COLOMBERA
A3: Via Locatelli - 24040 OSIO SOPRA (BG)
A4: C.F. 95108370164 - P.IVA 02722270168
A6: SCUOLA CIVICA DI ARTE E MUSICA DI OSIO SOPRA
A7: BILANCIO ABBATTIMENTO RETTE
A8: Anno Scolastico 2003/2004
A9: I dati sono espressi in EURO
A11: RICAVI
A12: RETTE FREQUENZA | J12: =SUM(H14:H16) -> 38176.666666666672
G13: Lordo | H13: Netto
A14: Rette frequenza - I rata | G14: 15030 | H14: =G14/1.2 -> 12525
A15: Rette frequenza - II rata | G15: 15270 | H15: =G15/1.2 -> 12725
A16: Rette frequenza - III rata | G16: 15512 | H16: =G16/1.2 -> 12926.666666666668
A17: RIPORTO DA BILANCIO ABBATTIMENTO RETTE 2002/2003 | J17: 399.61
A18: CONTRIBUTI COMUNALI IN ACCONTO | J18: =SUM(H19:H20) -> 17444.32
A19: Rata Novembre 2003 | H19: 6406
A20: Rata Febbraio 2004 | H20: 11038.32
A21: TOTALE RICAVI | J21: =SUM(J12:J20) -> 56020.596666666672
A23: COSTI
A24: COMPENSI LORDI EROGATI AI DOCENTI | J24: =SUM(H25:H27) -> 49977.96
A25: RETRIBUZIONI DOCENTI Dic. 2003 | H25: 18183.38
A26: RETRIBUZIONI DOCENTI Feb. 2004 | H26: 15435.24
A27: RETRIBUZIONI DOCENTI Mag. 2004 | H27: 16359.34
A28: CONTRIBUTI INPS A CARICO ASSOCIAZIONE | J28: =SUM(H29:H31) -> 4182
A29: CONTRIBUTI INPS 12/2003 | H29: 1319
A30: CONTRIBUTI INPS 02/2004 | H30: 1415
A31: CONTRIBUTI INPS 05/2004 | H31: 1448
A32: IMPOSTE E TASSE | J32: =SUM(H33:H35) -> 2194.9800580000001
A33: IRAP 4,25% su Imponibile Previdenziale compensi docenti | H33: =J24*(4.25/100) -> 2124.0633000000003
A34: IRAP su rette di frequenza (3/100*4,25/100) | H34: =J12*3/100*4.25/100 -> 48.675250000000005
A35: IRAP su contributi Comunali per gestione corsi (3/100*4,25/100) | H35: =J18*3/100*4.25/100 -> 22.241508000000003
A36: TOTALE COSTI | J36: =SUM(J24:J35) -> 56354.940058000007
A39: RIEPILOGO
D42: RICAVI | E42: =SUM(J21) -> 56020.596666666672 | F42: COSTI | H42: COSTI | J42: =SUM(J36) -> 56354.940058000007
A44: CONTRIBUTO COMUNALE A SALDO | E44: =J42-E42 -> 334.3433913333356
A47: Totale contributo comunale | E47: =J17+J18+E44 -> 18178.273391333336 | F47: =E47*100/J42 -> 32.256752243236207 | G47: =E47*100/J42 -> 32.256752243236207

A1: ASSOCIAZIONE CULTURALE LA COLOMBERA
A2: Via Locatelli - 24040 OSIO SOPRA (BG)
A3: C.F. 95108370164 - P.IVA 02722270168
A4: SCUOLA CIVICA DI ARTE E MUSICA DI OSIO SOPRA
A5: SPESE FISSE DI GESTIONE
A6: Anno Scolastico 2003/2004
A7: I dati sono espressi in EURO
A9: RICAVI
A10: RIPORTO DA BILANCIO SPESE FISSE DI GESTIONE 2002/2003 | J10: 1432.68
A11: CONTRIBUTO COMUNALE | J11: =SUM(H12:H13) -> 5264.34
A12: Contributo Comunale Novembre 2003 | H12: 690.76
A13: Contributo Comunale Febbraio 2004 | H13: 4573.58
A14: TOTALE RICAVI | J14: =SUM(J10:J13) -> 6697.02
A16: COSTI
A17: DIREZIONE ARTISTICA | J17: 700
A18: PROGETTO RAINBOW | J18: =SUM(H19:H21) -> 686.47249999999997
A19: Lordo agli insegnanti | H19: 1317
A20: IRAP relativa | H20: =H19*(4.25/100) -> 55.972499999999997
A21: Contributo da Associazione "La Colombera" | H21: -686.5
A22: MATERIALI PER CORSI D'ARTE | H22: - IVA | J22: =SUM(H23:H27) -> 527.5
A23: Abbonamento riviste | G23: 108 | H23: =G23/1.2 -> 90
A24: Partiture varie | G24: 41 | H24: =G24/1.2 -> 34.166666666666671
A25: Spese varie per corso pittura | G25: 200 | H25: =G25/1.2 -> 166.66666666666669
A26: Acquisto Violino usato | G26: 200 | H26: =G26/1.2 -> 166.66666666666669
A27: Accordatura pianoforte | G27: 84 | H27: =G27/1.2 -> 70
A28: PUBBLICITA' E SAGGI DI FINE ANNO | H28: - IVA | J28: =SUM(H29:H31) -> 1763.0333333333335
A29: Stampa pubblicità e libretto | G29: 1445.4 | H29: =G29/1.2 -> 1204.5
A30: Libretto lezioni e altra cancelleria | G30: 262.24 | H30: =G30/1.2 -> 218.53333333333336
A31: Noleggio pianoforte per saggi | G31: 408 | H31: =G31/1.2 -> 340
A32: ONORARI CONSULENZA FISCALE E DEL LAVORO | J32: =SUM(H33:H34) -> 1800
A33: Consulenza fiscale (1200 per anno 2003 diviso 2) | H33: 600
A34: Servizio Paghe | H34: 1200
A35: SPESE VARIE | H35: - IVA | J35: =SUM(H36:H41) -> 333.18333333333334
A36: Postali | G36: 103.92 | H36: =G36/1.2 -> 86.6
A37: Telefoniche | G37: 100 | H37: =G37/1.2 -> 83.333333333333343
A38: Orologio | G38: 32.29 | H38: =G38/1.2 -> 26.908333333333335
A39: Cancelleria | G39: 81.11 | H39: =G39/1.2 -> 67.591666666666669
A40: Riparazione fotocopiatrice | G40: 62 | H40: =G40/1.2 -> 51.666666666666671
A41: Serrature e chiavi | G41: 20.5 | H41: =G41/1.2 -> 17.083333333333336
A42: IMPOSTE E TASSE | J42: =SUM(H43:H46) -> 664.27356150000014
A43: IRAP su contributo comuanle gestione scuola (3/100*4,25/100) | H43: =J11*3/100*4.25/100 -> 6.7120335000000004
A44: IRPEG su contributo comunale gestione scuola (3/100*36/100) | H44: =J11*3/100*36/100 -> 56.854872000000007
A45: IRPEG su rette di frequenza (3/100*36/100) | H45: 412.30800000000005
A46: IRPEG su contributi comunali gestione corsi (3/100*36/100) | H46: 188.39865600000002
A47: TOTALE COSTI | J47: =SUM(J17:J46) -> 6474.4627281666671
A49: RIEPILOGO
A50: TOTALE RICAVI | E50: =SUM(J14) -> 6697.02 | F50: TOTALE COSTI | J50: =J47 -> 6474.4627281666671
A51: CONTRIBUTO COMUNALE A SALDO | E51: =J50-E50 -> -222.55727183333329
A53: Totale contributo comunale | E53: =J14+E51 -> 6474.4627281666671