B2: ASSOCIAZIONE CULTURALE LA COLOMBERA
B3: Via Locatelli - 24040 OSIO SOPRA (BG)
B4: C.F. 95108370164 - P.IVA 02722270168
B6: SCUOLA CIVICA DI ARTE E MUSICA DI OSIO SOPRA
B7: BILANCIO ABBATTIMENTO RETTE Anno Scolastico 2005/2006
B9: RICAVI
B10: RETTE FREQUENZA | J10: =SUM(H12:H14) -> 41605.833333333336
H11: Lordo | I11: Netto
B12: Rette frequenza - I rata | H12: 16091 | I12: =G12/1.2 -> 13409.166666666668
B13: Rette frequenza - II rata | H13: 16205 | I13: =G13/1.2 -> 13504.166666666668
B14: Rette frequenza - III rata | H14: 17631 | I14: =G14/1.2 -> 14692.5
B15: RIPORTO DA BILANCIO ABBATTIMENTO RETTE 2004/2005 | J15: 1097.51
B16: DA BILANCIO GESTIONE SCUOLA PER SCONTO BANDA MARIANO | J16: 812.5
B17: CONTRIBUTI COMUNALI IN ACCONTO | J17: =SUM(H18:H19) -> 16806.9
B18: Rata Novembre 2005 | I18: 5002.69
B19: Rata Febbraio 2006 | I19: 11804.21
B20: TOTALE RICAVI | J20: =SUM(J10:J19) -> 60322.743333333332
B21: COSTI
B22: COMPENSI LORDI EROGATI AI DOCENTI | J22: =SUM(H24:H26) -> 53496.54
B23: RETRIBUZIONI DOCENTI Dic. 2005 | I23: 18824.32
B24: RETRIBUZIONI DOCENTI Feb. 2006 | I24: 11888.12
B25: RETRIBUZIONI DOCENTI Mag. 2006 | I25: 22784.1
B26: CONTRIBUTI INPS A CARICO ASSOCIAZIONE | J26: =SUM(H28:H30) -> 4821
B27: CONTRIBUTI INPS 12/2005 | I27: 1706
B28: CONTRIBUTI INPS 02/2006 | I28: 1208
B29: CONTRIBUTI INPS 05/2006 | I29: 1907
B30: IMPOSTE E TASSE | J30: =SUM(H32:H36) -> 2978.9367050000005
B31: IRAP 4,25% su Imponibile Previdenziale compensi docenti | I31: =J23*(4.25/100) -> 2273.6029500000004
B32: IRPEG su rette di frequenza (3/100*36/100) | I32: =J10*3/100*36/100 -> 449.34299999999996
B33: IRAP su rette di frequenza (3/100*4,25/100) | I33: =J10*3/100*4.25/100 -> 53.047437499999994
B34: IRPEG su contributi comunali gestione corsi (3/100*36/100) | I34: =J17*3/100*36/100 -> 181.51452
B35: IRAP su contributi Comunali per gestione corsi (3/100*4,25/100) | I35: =J17*3/100*4.25/100 -> 21.428797500000002
B36: TOTALE COSTI | J36: =SUM(J23:J36) -> 61296.476705000001
B38: RIEPILOGO
E40: RICAVI | F40: =SUM(J20) -> 60322.743333333332 | G40: COSTI | I40: COSTI | J40: =SUM(J37) -> 61296.476705000001
B42: CONTRIBUTO COMUNALE A SALDO | F42: =J43-E43 -> 973.73337166666897
B44: Totale contributo comunale | F44: =J15+J17+E45 -> 18878.143371666665 | G44: =E48*100/J43 -> 30.798088873070188 | H44: =E48*100/J43 -> 30.798088873070188