A1: ASSOCIAZIONE CULTURALE LA COLOMBERA
A2: Via Locatelli - 24040 OSIO SOPRA (BG)
A3: C.F. 95108370164 - P.IVA 02722270168
A4: SCUOLA CIVICA DI ARTE E MUSICA DI OSIO SOPRA
A5: SPESE FISSE DI GESTIONE Anno Scolastico 2005/2006
A7: RICAVI
A8: RIPORTO DA BILANCIO SPESE FISSE DI GESTIONE 2004/2005 | J8: 34.13
A9: CONTRIBUTO COMUNALE | J9: =SUM(I10:I11) -> 8594.67
A10: Contributo Comunale Novembre 2005 | I10: 2968.4
A11: Contributo Comunale Febbraio 2006 | I11: 5626.27
A12: TOTALE RICAVI | J12: =SUM(K8:K11) -> 8628.8
A14: COSTI
A15: MATERIALI PER CORSI D'ARTE | G15: Lordo | H15: Iva | I15: Netto | J15: =SUM(I16:I24) -> 901.33333333333337
A16: Pelli e ricambi batteria (Di Gioia) | G16: 150 | H16: 20 | I16: =G16/(1+H16/100) -> 125
A17: Partiture (Maffeis) | G17: 47 | H17: 4 | I17: =G17/(1+H17/100) -> 45.192307692307693
A18: Rivista Art Dossier | G18: 120.6 | H18: 20 | I18: =G18/(1+H18/100) -> 100.5
A19: Spese colorificio per corso pittura | G19: 200 | H19: 20 | I19: =G19/(1+H19/100) -> 166.66666666666669
A20: Albums vari per Atelier | G20: 20 | H20: 20 | I20: =G20/(1+H20/100) -> 16.666666666666668
A21: Varie per Atelier ragazzi | G21: 24 | H21: 20 | I21: =G21/(1+H21/100) -> 20
A22: Trio Montarbo | G22: 240 | H22: 20 | I22: =G22/(1+H22/100) -> 200
A23: Rivista Pittura | G23: 42 | H23: 20 | I23: =G23/(1+H23/100) -> 35
A24: Partiture varie per archivio | G24: 200 | H24: 4 | I24: =G24/(1+H24/100) -> 192.30769230769229
A25: PUBBLICITA' e SAGGI | G25: Lordo | H25: Iva | I25: Netto | J25: =SUM(I26:I29) -> 2296.2
A26: Opuscolo informativo | G26: 1495.44 | H26: 20 | I26: =G26/(1+H26/100) -> 1246.2
A27: Auditorium | G27: 600 | H27: 20 | I27: =G27/(1+H27/100) -> 500
A28: Casa ad archi | G28: 250 | H28: 0 | I28: =G28/(1+H28/100) -> 250
A29: Noleggio pianoforte per saggi | G29: 360 | H29: 20 | I29: =G29/(1+H29/100) -> 300
A30: ONORARI CONSULENZA FISCALE E DEL LAVORO | J30: =SUM(I31:I32) -> 2096
A31: Consulenza fiscale | I31: 1048
A32: Servizio Paghe | I32: 1048
A33: COORDINAMENTO DIDATTICO | J33: =SUM(I34) -> 983.36
A34: Compenso annuale (totale 56 ore) | I34: 983.36
A35: TELEFONICHE E POSTALI | J35: =SUM(I36:I36) -> 353.5
A36: Ricariche omnitel e spese postali | I36: 353.5
A37: SCONTO BANDA MARIANO | J37: =SUM(I38:I38) -> 812.5
A38: 8 Teoria, 4 B.30 (sconto), 2 A e 2A (sconto) | G38: 975 | H38: 20 | I38: =G38/(1+H38/100) -> 812.5
A39: SPESE VARIE | G39: Lordo | H39: Iva | I39: Netto | J39: =SUM(I40:I43) -> 977.79166666666674
A40: Cancelleria | G40: 550 | H40: 20 | I40: =G40/(1+H40/100) -> 458.33333333333337
A41: Materiali | G41: 214.35 | H41: 20 | I41: =G41/(1+H41/100) -> 178.625
A42: Accordatura pianoforte | G42: 90 | H42: 20 | I42: =G42/(1+H42/100) -> 75
A43: Serrature, chiavi e varie | G43: 319 | H43: 20 | I43: =G43/(1+H43/100) -> 265.83333333333337
A44: IMPOSTE E TASSE | J44: =SUM(I45:I46) -> 103.78064025
A45: IRAP su contributo comuanle gestione scuola (3/100*4,25/100) | I45: =K9*3/100*4.25/100 -> 10.958204250000001
A46: IRPEG su contributo comunale gestione scuola (3/100*36/100) | I46: =K9*3/100*36/100 -> 92.822435999999996
A47: TOTALE COSTI | J47: =SUM(K15:K46) -> 8524.4656402499986
A49: RIEPILOGO
A50: TOTALE RICAVI | E50: =SUM(K12) -> 8628.8 | F50: TOTALE COSTI | J50: =K47 -> 8524.4656402499986
A51: CONTRIBUTO COMUNALE A SALDO | E51: =K50-E50 -> -104.33435975000066
A53: Totale contributo comunale | E53: =K12+E51 -> 8524.4656402499986