A2: ASSOCIAZIONE CULTURALE LA COLOMBERA
A3: Via Locatelli - 24040 OSIO SOPRA (BG)
A4: C.F. 95108370164 - P.IVA 02722270168
A6: SCUOLA CIVICA DI ARTE E MUSICA DI OSIO SOPRA
A7: BILANCIO ABBATTIMENTO RETTE
A8: Anno Scolastico 2002/2003
A9: I dati sono espressi in EURO
A11: RICAVI
A12: RETTE FREQUENZA | J12: =SUM(H13:H15) -> 37277.919999999998
A13: Rette frequenza - I rata | H13: 12542.92
A14: Rette frequenza - II rata | H14: 12532.92
A15: Rette frequenza - III rata | H15: 12202.08
A16: RESIDUO ANNO PRECEDENTE | J16: 2791.57
A17: CONTRIBUTI COMUNALI IN ACCONTO | J17: =SUM(H18:H19) -> 15756.34
A18: Rata Novembre 2002 | H18: 2858.05
A19: Rata Febbraio 2003 | H19: 12898.29
A20: TOTALE RICAVI | J20: =SUM(J12:J19) -> 55825.83
A22: COSTI
A23: COMPENSI LORDI EROGATI AI DOCENTI | J23: =SUM(H24:H26) -> 49207.51
A24: RETRIBUZIONI DOCENTI Dic. 2002 | H24: 17607.1
A25: RETRIBUZIONI DOCENTI Feb. 2003 | H25: 17607.1
A26: RETRIBUZIONI DOCENTI Mag. 2003 | H26: 13993.31
A27: CONTRIBUTI INPS A CARICO ASSOCIAZIONE | J27: =SUM(H28:H30) -> 3487
A28: CONTRIBUTI INPS 11/2001 | H28: 1266
A29: CONTRIBUTI INPS 02/2002 | H29: 1266
A30: CONTRIBUTI INPS 06/2002 | H30: 955
A31: IMPOSTE E TASSE | J31: =SUM(H32:H36) -> 2731.7078644999997
A32: IRAP 4,25% su Imponibile Previdenziale compensi docenti | H32: =J23*4.25/100 -> 2091.3191749999996
A33: IRAP su rette di frequenza (3/100*4,25/100) | H33: =J12*3/100*4.25/100 -> 47.529347999999992
A34: IRPEG su rette di frequenza (3/100*36/100) | H34: =J12*3/100*36/100 -> 402.6015359999999
A35: IRAP su contributi Comunali per gestione corsi (3/100*4,25/100) | H35: =J17*3/100*4.25/100 -> 20.089333500000002
A36: IRPEG su contributi comunali gestione corsi (3/100*36/100) | H36: =J17*3/100*36/100 -> 170.16847200000004
A37: TOTALE COSTI | J37: =SUM(J23,J27,J31) -> 55426.217864499995
A40: RIEPILOGO
A43: RICAVI | E43: =SUM(J20) -> 55825.83 | F43: COSTI | J43: =SUM(J37) -> 55426.217864499995
A45: CONTRIBUTO COMUNALE A SALDO | E45: =J43-E43 -> -399.61213550000684
A48: Totale contributo comunale | E48: =J16+J17+E45 -> 18148.297864499993 | F48: =E48*100/J43 -> 32.743164812123716 | G48: %