A1: COMUNE DI OSIO SOPRA Civica Scuola di Arte e Musica

A1: Corso | B1: Allievi residenti | D1: Allievi non residenti | F1: TOTALE
B2: Minori di 21 anni | C2: Maggiori di 21 anni | D2: Minori di 21 anni | E2: Maggiori di 21 anni
A3: Corso di Musica A Professionale | B3: 7 | D3: 7 | F3: 14
A4: Corso di Musica B.30 Amatoriale | B4: 4 | D4: 5 | F4: 9
A5: Corso di Musica B.45 Amatoriale | B5: 51 | C5: 1 | D5: 26 | E5: 2 | F5: 80
A6: Corso di Musica B.60 Amatoriale | B6: 1 | D6: 1 | F6: 2
A7: Solo Propedeutica e Teoria | B7: 7 | D7: 14 | F7: 21
A8: Solo Musica d’insieme | D8: 2 | F8: 2
A9: Atelier Ragazzi | B9: 6 | D9: 1 | F9: 7
A10: Pittura | B10: 4 | C10: 3 | D10: 1 | E10: 16 | F10: 24
A11: TOTALE | B11: 80 | C11: 4 | D11: 57 | E11: 18 | F11: 159

B1: Preventivo | C1: Consuntivo | D1: Differenza
A2: Contributo per abbattimento rette | B2: 18.547,91 | C2: 18.148,30 | D2: - 399,61
A3: Spese fisse di gestione della Scuola | B3: 7.095,19 | C3: 5.662,51 | D3: -1.432,68
A4: Totale | B4: 25.643,10 | C4: 23.810,81 | D4: -1.832,29

B2: ASSOCIAZIONE CULTURALE LA COLOMBERA
B3: Via Locatelli - 24040 OSIO SOPRA (BG)
B4: C.F. 95108370164 - P.IVA 02722270168
B6: SCUOLA CIVICA DI ARTE E MUSICA DI OSIO SOPRA
B7: BILANCIO ABBATTIMENTO RETTE
B8: Anno Scolastico 2002/2003
B9: I dati sono espressi in EURO
B11: RICAVI
B12: RETTE FREQUENZA | J12: =SUM(H13:H15) -> 37277.919999999998
B13: Rette frequenza - I rata | H13: 12542.92
B14: Rette frequenza - II rata | H14: 12532.92
B15: Rette frequenza - III rata | H15: 12202.08
B16: RESIDUO ANNO PRECEDENTE | J16: 2791.57
B17: CONTRIBUTI COMUNALI IN ACCONTO | J17: =SUM(H18:H19) -> 15756.34
B18: Rata Novembre 2002 | H18: 2858.05
B19: Rata Febbraio 2003 | H19: 12898.29
B20: TOTALE RICAVI | J20: =SUM(J12:J19) -> 55825.83
B22: COSTI
B23: COMPENSI LORDI EROGATI AI DOCENTI | J23: =SUM(H24:H26) -> 49207.51
B24: RETRIBUZIONI DOCENTI Dic. 2002 | H24: 17607.1
B25: RETRIBUZIONI DOCENTI Feb. 2003 | H25: 17607.1
B26: RETRIBUZIONI DOCENTI Mag. 2003 | H26: 13993.31
B27: CONTRIBUTI INPS A CARICO ASSOCIAZIONE | J27: =SUM(H28:H30) -> 3487
B28: CONTRIBUTI INPS 11/2001 | H28: 1266
B29: CONTRIBUTI INPS 02/2002 | H29: 1266
B30: CONTRIBUTI INPS 06/2002 | H30: 955
B31: IMPOSTE E TASSE | J31: =SUM(H32:H36) -> 2731.7078644999997
B32: IRAP 4,25% su Imponibile Previdenziale compensi docenti | H32: =J23*4.25/100 -> 2091.3191749999996
B33: IRAP su rette di frequenza (3/100*4,25/100) | H33: =J12*3/100*4.25/100 -> 47.529347999999992
B34: IRPEG su rette di frequenza (3/100*36/100) | H34: =J12*3/100*36/100 -> 402.6015359999999
B35: IRAP su contributi Comunali per gestione corsi (3/100*4,25/100) | H35: =J17*3/100*4.25/100 -> 20.089333500000002
B36: IRPEG su contributi comunali gestione corsi (3/100*36/100) | H36: =J17*3/100*36/100 -> 170.16847200000004
B37: TOTALE COSTI | J37: =SUM(J23,J27,J31) -> 55426.217864499995
B39: RIEPILOGO
B40: RICAVI | E40: =SUM(J20) -> 55825.83 | F40: COSTI | J40: =SUM(J37) -> 55426.217864499995
B41: CONTRIBUTO COMUNALE A SALDO | E41: =J43-E43 -> -399.61213550000684
B42: Totale contributo comunale | E42: =J16+J17+E45 -> 18148.297864499993 | F42: =E48*100/J43 -> 32.743164812123716 | G42: %

A2: ASSOCIAZIONE CULTURALE LA COLOMBERA
A3: Via Locatelli - 24040 OSIO SOPRA (BG)
A4: C.F. 95108370164 - P.IVA 02722270168
A6: SCUOLA CIVICA DI ARTE E MUSICA DI OSIO SOPRA
A7: SPESE FISSE DI GESTIONE
A8: Anno Scolastico 2002/2003
A9: I dati sono espressi in EURO
A11: RICAVI
A12: RESIDUO ANNO PRECEDENTE | J12: 585.1
A13: CONTRIBUTO COMUNALE | J13: =SUM(H14:H15) -> 6510.09
A14: Contributo Comunale Novembre 2001 | H14: 1894.93
A15: Contributo Comunale Febbraio 2002 | H15: 4615.16
A16: TOTALE RICAVI
A18: COSTI
A19: DIREZIONE ARTISTICA | J19: =SUM(H20:H21) -> 700
A20: Compenso per Direzione artistica 2002 | H20: 262.5
A21: Compenso per Direzione artistica 2003 | H21: 437.5
A22: MATERIALI PER CORSI D'ARTE | J22: =SUM(H24:H27) -> 907.09
A23: Abbonamento riviste di pittura | H23: 79
A24: Materiale consumo per corso pittura | H24: 291.67
A25: Accordatura Pianoforte | H25: 60
A26: Partiture, duschetti e pelli | H26: 138.75
A27: Materiale consumo per corsi di musica | H27: 416.67
A28: PUBBLICITA' E SAGGI DI FINE ANNO | J28: =SUM(H29:H33) -> 1729.93
A29: Stampa pubblicità e libretto | H29: 1072
A30: Spedizione libretti e invito insegnanti | H30: 36.5
A31: Libretto lezioni | H31: 131.43
A32: Noleggio pianoforte per saggi | H32: 340
A33: Volantini saggi | H33: 150
A34: ONORARI CONSULENZA FISCALE E DEL LAVORO | J34: =SUM(H35:H37) -> 1832.16
A35: Consulenza fiscale 3° trim.2001 | H35: 316.08
A36: Consulenza fiscale 4° trim.2001 | H36: 316.08
A37: Servizio Paghe | H37: 1200
A38: SPESE VARIE | J38: =SUM(H39:H43) -> 414.72
A39: Sostituzione telefono cellulare segreteria | H39: 57.5
A40: Spese Telefoniche Omnitel | H40: 160
A41: Passatoia | H41: 58.3
A42: Cancelleria Cartosama | H42: 59.6
A43: Serrature e chiavi | H43: 79.32
A44: IMPOSTE E TASSE | J44: =SUM(H45:H46) -> 78.609336749999997
A45: IRAP su contributo comuanle gestione scuola (3/100*4,25/100) | H45: =J13*3/100*4.25/100 -> 8.3003647500000017
A46: IRPEG su contributo comunale gestione scuola (3/100*36/100) | H46: =J13*3/100*36/100 -> 70.308971999999997
A47: TOTALE COSTI | J47: =SUM(J19:J46) -> 5662.5093367500003
A49: RIEPILOGO
A50: TOTALE RICAVI | E50: =SUM(J16) -> 7095.19 | F50: TOTALE COSTI | J50: =J47 -> 5662.5093367500003
A51: CONTRIBUTO COMUNALE A SALDO | E51: =J53-E53 -> -1432.6806632500002
A52: Totale contributo comunale | E52: =J12+J13+E56 -> 5662.5093367500003