A2: ASSOCIAZIONE CULTURALE LA COLOMBERA
A3: Via Locatelli - 24040 OSIO SOPRA (BG)
A4: C.F. 95108370164 - P.IVA 02722270168
A6: SCUOLA CIVICA DI ARTE E MUSICA DI OSIO SOPRA
A7: SPESE FISSE DI GESTIONE
A8: Anno Scolastico 2002/2003
A9: I dati sono espressi in EURO
A11: RICAVI
A12: RESIDUO ANNO PRECEDENTE | J12: 585.1
A13: CONTRIBUTO COMUNALE | J13: =SUM(H14:H15) -> 6510.09
A14: Contributo Comunale Novembre 2001 | H14: 1894.93
A15: Contributo Comunale Febbraio 2002 | H15: 4615.16
A16: TOTALE RICAVI | J16: =SUM(J12:J15) -> 7095.19
A18: COSTI
A19: DIREZIONE ARTISTICA | J19: =SUM(H20:H21) -> 700
A20: Compenso per Direzione artistica 2002 | H20: 262.5
A21: Compenso per Direzione artistica 2003 | H21: 437.5
A22: MATERIALI PER CORSI D'ARTE | J22: =SUM(H24:H27) -> 907.09
A23: Abbonamento riviste di pittura | H23: 79
A24: Materiale consumo per corso pittura | H24: 291.67
A25: Accordatura Pianoforte | H25: 60
A26: Partiture, duschetti e pelli | H26: 138.75
A27: Materiale consumo per corsi di musica | H27: 416.67
A28: PUBBLICITA' E SAGGI DI FINE ANNO | J28: =SUM(H29:H33) -> 1729.93
A29: Stampa pubblicità e libretto | H29: 1072
A30: Spedizione libretti e invito insegnanti | H30: 36.5
A31: Libretto lezioni | H31: 131.43
A32: Noleggio pianoforte per saggi | H32: 340
A33: Volantini saggi | H33: 150
A34: ONORARI CONSULENZA FISCALE E DEL LAVORO | J34: =SUM(H35:H37) -> 1832.16
A35: Consulenza fiscale 3° trim.2001 | H35: 316.08
A36: Consulenza fiscale 4° trim.2001 | H36: 316.08
A37: Servizio Paghe | H37: 1200
A38: SPESE VARIE | J38: =SUM(H39:H43) -> 414.72
A39: Sostituzione telefono cellulare segreteria | H39: 57.5
A40: Spese Telefoniche Omnitel | H40: 160
A41: Passatoia | H41: 58.3
A42: Cancelleria Cartosama | H42: 59.6
A43: Serrature e chiavi | H43: 79.32
A44: IMPOSTE E TASSE | J44: =SUM(H45:H46) -> 78.609336749999997
A45: IRAP su contributo comuanle gestione scuola (3/100*4,25/100) | H45: =J13*3/100*4.25/100 -> 8.3003647500000017
A46: IRPEG su contributo comunale gestione scuola (3/100*36/100) | H46: =J13*3/100*36/100 -> 70.308971999999997
A47: TOTALE COSTI | J47: =SUM(J19:J46) -> 5662.5093367500003
A50: RIEPILOGO
A53: TOTALE RICAVI | E53: =SUM(J16) -> 7095.19 | F53: TOTALE COSTI | J53: =J47 -> 5662.5093367500003
A56: CONTRIBUTO COMUNALE A SALDO | E56: =J53-E53 -> -1432.6806632500002
A59: Totale contributo comunale | E59: =J12+J13+E56 -> 5662.5093367500003