C1: ASSOCIAZIONE CULTURALE LA COLOMBERA
C2: Via Locatelli - 24040 OSIO SOPRA (BG)
C3: C.F. 95108370164 - P.IVA 02722270168
C5: SCUOLA CIVICA DI ARTE E MUSICA DI OSIO SOPRA
C6: BILANCIO ABBATTIMENTO RETTE Anno Scolastico 2006/2007
C8: RICAVI
C9: RETTE FREQUENZA | J9: =SUM(H11:H13) -> 41944.166666666672
G10: Lordo | H10: Netto
C11: Rette frequenza - I rata | G11: 16672 | H11: =G11/1.2 -> 13893.333333333334
C12: Rette frequenza - II rata | G12: 17074 | H12: =G12/1.2 -> 14228.333333333334
C13: Rette frequenza - III rata | G13: 16587 | H13: =G13/1.2 -> 13822.5
C14: RIPORTO DA BILANCIO ABBATTIMENTO RETTE 2005/2006 | J14: -973.73
C15: DA BILANCIO GESTIONE SCUOLA PER SCONTO BANDA MARIANO | J15: 485
C16: CONTRIBUTI COMUNALI IN ACCONTO | J16: =SUM(H17:H18) -> 19229.71
C17: Contributo Comunale Novembre 2006 (fattura IVA escl) | H17: 8053.03
C18: Contributo Comunale Febbraio 2007 Fattura IVA escl) | H18: 11176.68
C19: TOTALE RICAVI | J19: =SUM(J9:J18) -> 60685.146666666667
C21: COSTI
C22: COMPENSI LORDI EROGATI AI DOCENTI (+ Coordinamento) | J22: =SUM(H23:H25) -> 51256.24
C23: RETRIBUZIONI DOCENTI Dic. 2005 | H23: 18893.84
C24: RETRIBUZIONI DOCENTI Feb. 2006 | H24: 9974.08
C25: RETRIBUZIONI DOCENTI Mag. 2006 | H25: 22388.32
C26: CONTRIBUTI INPS A CARICO ASSOCIAZIONE | J26: =SUM(H27:H29) -> 5485.73
C27: CONTRIBUTI INPS 12/2005 | H27: 1608.69
C28: CONTRIBUTI INPS 02/2006 | H28: 1390.51
C29: CONTRIBUTI INPS 05/2006 | H29: 2486.53
C30: IMPOSTE E TASSE | J30: =SUM(H31:H35) -> 2917.06476075
C31: IRAP 4,25% su Imponibile Previdenziale compensi docenti | H31: =J22*(4.25/100) -> 2178.3902000000003
C32: IRPEG su rette di frequenza (3/100*36/100) | H32: =J9*3/100*36/100 -> 452.99700000000007
C33: IRAP su rette di frequenza (3/100*4,25/100) | H33: =J9*3/100*4.25/100 -> 53.478812500000004
C34: IRPEG su contributi comunali gestione corsi (3/100*36/100) | H34: =J16*3/100*36/100 -> 207.680868
C35: IRAP su contributi Comunali per gestione corsi (3/100*4,25/100) | H35: =J16*3/100*4.25/100 -> 24.517880249999997
C36: TOTALE COSTI | J36: =SUM(J22:J35) -> 59659.034760750001
C38: RIEPILOGO
D40: RICAVI | E40: =SUM(J19) -> 60685.146666666667 | F40: COSTI | H40: COSTI | J40: =SUM(J36) -> 59659.034760750001
C42: CONTRIBUTO COMUNALE A SALDO | E42: =J42-E42 -> -1026.1119059166667
C44: Totale contributo comunale | E44: =J14+J16+E44 -> 17229.868094083333 | F44: =E47*100/J42 -> 28.880567986357963 | G44: =E47*100/J42 -> 28.880567986357963