A1: ASSOCIAZIONE CULTURALE LA COLOMBERA
A2: Via Locatelli - 24040 OSIO SOPRA (BG)
A3: C.F. 95108370164 - P.IVA 02722270168
A4: SCUOLA CIVICA DI ARTE E MUSICA DI OSIO SOPRA
A5: SPESE FISSE DI GESTIONE Anno Scolastico 2006/2007
A7: RICAVI
A8: RIPORTO DA BILANCIO SPESE FISSE DI GESTIONE 2005/2006 | K8: 104.33
A9: CONTRIBUTO COMUNALE | K9: =SUM(I10:I11) -> 8771.73
A10: Contributo Comunale Novembre 2006 (fattura IVA escl) | I10: 3092.35
A11: Contributo Comunale Febbraio 2007 Fattura IVA escl) | I11: 5679.38
A12: TOTALE RICAVI | K12: =SUM(K8:K11) -> 8876.06
A14: COSTI
A15: MATERIALI E PREST. PER CORSI | G15: Lordo | H15: Iva | I15: Netto | K15: =SUM(I16:I21) -> 600
A16: Piatto Paiste 16 | G16: 30 | H16: 20 | I16: =G16/1.2 -> 25
A17: Pezzi di ricambio e varie per batteria | G17: 315 | H17: 20 | I17: =G17/1.2 -> 262.5
A18: Accordatura pianoforte | G18: 90 | H18: 20 | I18: =G18/1.2 -> 75
A19: Rivista Art Dossier | G19: 42 | H19: 20 | I19: =G19/1.2 -> 35
A20: Spese per corsi pittura (Gualandris) | G20: 200 | H20: 20 | I20: =G20/1.2 -> 166.66666666666669
A21: Spese colorificio per atelier ragazzi | G21: 43 | H21: 20 | I21: =G21/1.2 -> 35.833333333333336
A22: PUBBLICITA' e SAGGI | G22: Lordo | H22: Iva | I22: Netto | K22: =SUM(I23:I27) -> 2565.416666666667
A23: Opuscolo informativo | G23: 1527 | H23: 20 | I23: =G23/1.2 -> 1272.5
A24: SIAE | G24: 300 | I24: 300
A25: Pubblicità saggi finali | G25: 249.5 | H25: 20 | I25: =G25/1.2 -> 207.91666666666669
A26: Rimborso per Auditorium | G26: 600 | I26: 600
A27: Rimborso Casa ad archi | G27: 185 | I27: 185
A28: ONORARI CONSULENZA FISCALE E DEL LAVORO | K28: =SUM(I29:I30) -> 2000
A29: Consulenza fiscale | G29: 1200 | I29: =G29/1.2 -> 1000
A30: Servizio Paghe | G30: 1200 | I30: =G30/1.2 -> 1000
A31: TELEFONICHE E POSTALI | K31: =SUM(I32:I32) -> 309
A32: Ricariche omnitel e spese postali | I32: 309
A33: SCONTO BANDA MARIANO | K33: =SUM(I34:I34) -> 485
A34: Professionali: 4, Teoria A3: 1 | G34: 582 | H34: 20 | I34: =G34/(1+H34/100) -> 485
A35: SPESE VARIE | G35: Lordo | H35: Iva | I35: Netto | K35: =SUM(I36:I38) -> 468.33333333333337
A36: Lampade serrature chiavi | G36: 180 | H36: 20 | I36: =G36/1.2 -> 150
A37: Segreteria e cancelleria (1) | G37: 228 | H37: 20 | I37: =G37/1.2 -> 190
A38: Segreteria e cancelleria (2) | G38: 154 | H38: 20 | I38: =G38/1.2 -> 128.33333333333334
A39: STRUMENTI E ATTREZZATURE | K39: =SUM(I40:I44) -> 2004.1666666666667
A40: Amplificatore multifunzionale | G40: 200 | H40: 20 | I40: =G40/1.2 -> 166.66666666666669
A41: Cassettiera Insegnanti norma Privacy | G41: 960 | H41: 20 | I41: =G41/1.2 -> 800
A42: Butterfly Voice System (+ 2 mic e aste) | G42: 805 | H42: 20 | I42: =G42/1.2 -> 670.83333333333337
A43: Chitarra classica elettrificata Yamaha CGX101 | G43: 300 | H43: 20 | I43: =G43/1.2 -> 250
A44: Flauto da studio | G44: 140 | H44: 20 | I44: =G44/1.2 -> 116.66666666666667
A45: IMPOSTE E TASSE | K45: =SUM(I46:I47) -> 105.91863975
A46: IRAP su contributo comuanle gestione scuola (3/100*4,25/100) | I46: =K9*3/100*4.25/100 -> 11.183955750000001
A47: IRPEG su contributo comunale gestione scuola (3/100*36/100) | I47: =K9*3/100*36/100 -> 94.734684000000001
A48: TOTALE COSTI | K48: =SUM(K15:K47) -> 8537.8353064166658
A50: RIEPILOGO
A51: TOTALE RICAVI | E51: =SUM(K12) -> 8876.06 | F51: TOTALE COSTI | K51: =K48 -> 8537.8353064166658
A52: CONTRIBUTO COMUNALE A SALDO | E52: =K51-E51 -> -338.22469358333365
A54: Totale contributo comunale | E54: =K12+E52 -> 8537.8353064166658