A2: ASSOCIAZIONE CULTURALE LA COLOMBERA
A3: Via Locatelli - 24040 OSIO SOPRA (BG)
A4: C.F. 95108370164 - P.IVA 02722270168
A6: SCUOLA CIVICA DI ARTE E MUSICA DI OSIO SOPRA
A7: BILANCIO ABBATTIMENTO RETTE Anno Scolastico 2008/2009
A9: RICAVI
A10: RETTE FREQUENZA | J10: =SUM(H12:H14) -> 48313.333333333336
G11: Lordo | H11: Netto
A12: Rette frequenza - I rata | G12: 19247 | H12: =G12/1.2 -> 16039.166666666668
A13: Rette frequenza - II rata | G13: 20291 | H13: =G13/1.2 -> 16909.166666666668
A14: Rette frequenza - III rata | G14: 18438 | H14: =G14/1.2 -> 15365
A15: RIPORTO DA BILANCIO ABBATTIMENTO RETTE 2007/2008 | J15: -637.54
A16: DA BILANCIO GESTIONE SCUOLA PER SCONTO BANDA MARIANO | J16: =Scuola!K37 -> 0
A17: CONTRIBUTI COMUNALI IN ACCONTO | J17: =SUM(H18:H19) -> 21509.075000000001
A18: Contributo Comunale Novembre 2008 (fattura IVA escl) | G18: 9295.54 | H18: =G18/1.2 -> 7746.2833333333347
A19: Contributo Comunale Febbraio 2009 Fattura IVA escl) | G19: 16515.35 | H19: =G19/1.2 -> 13762.791666666666
A20: TOTALE RICAVI | J20: =SUM(J10:J19) -> 69184.868333333332
A22: COSTI
A23: COMPENSI LORDI EROGATI AI DOCENTI (+ Coordinamento) | J23: =SUM(H24:H26) -> 57496.68
A24: RETRIBUZIONI DOCENTI Dic. 2008 | H24: 19824.48
A25: RETRIBUZIONI DOCENTI Feb. 2009 | H25: 13626
A26: RETRIBUZIONI DOCENTI Mag. 2009 | H26: 24046.2
A27: CONTRIBUTI INPS A CARICO ASSOCIAZIONE | J27: =SUM(H28:H30) -> 6947.05
A28: CONTRIBUTI INPS 12/2008 | H28: 2347.45
A29: CONTRIBUTI INPS 02/2009 | H29: 1673.85
A30: CONTRIBUTI INPS 05/2009 | H30: 2925.75
A31: IMPOSTE E TASSE | J31: =SUM(H32:H36) -> 3286.7144806249994
A32: IRAP 4,25% su Imponibile Previdenziale compensi docenti | H32: =J23*(4.25/100) -> 2443.6088999999997
A33: IRPEG su rette di frequenza (3/100*36/100) | H33: =J10*3/100*36/100 -> 521.78399999999999
A34: IRAP su rette di frequenza (3/100*4,25/100) | H34: =J10*3/100*4.25/100 -> 61.599500000000006
A35: IRPEG su contributi comunali gestione corsi (3/100*36/100) | H35: =J17*3/100*36/100 -> 232.29801000000003
A36: IRAP su contributi Comunali per gestione corsi (3/100*4,25/100) | H36: =J17*3/100*4.25/100 -> 27.424070625000002
A37: TOTALE COSTI | J37: =SUM(J23:J36) -> 67730.444480624996
A40: RIEPILOGO
D43: RICAVI | E43: =SUM(J20) -> 69184.868333333332 | F43: COSTI | H43: COSTI | J43: =SUM(J37) -> 67730.444480624996
A45: CONTRIBUTO COMUNALE A SALDO | E45: =J43-E43 -> -1454.4238527083362
A48: Totale contributo comunale | E48: =J15+J17+E45 -> 19417.111147291664 | F48: =E48*100/J43 -> 28.668217514571502 | G48: =E48*100/J43 -> 28.668217514571502