A1: ASSOCIAZIONE CULTURALE LA COLOMBERA
A2: Via Locatelli - 24040 OSIO SOPRA (BG)
A3: C.F. 95108370164 - P.IVA 02722270168
A4: SCUOLA CIVICA DI ARTE E MUSICA DI OSIO SOPRA
A5: SPESE FISSE DI GESTIONE Anno Scolastico 2008/2009
A7: RICAVI
A8: RIPORTO DA BILANCIO SPESE FISSE DI GESTIONE 2007/2008 | K8: 735.59
A9: CONTRIBUTO COMUNALE | K9: =SUM(I10:I11) -> 8012.35
A10: Contributo Comunale Novembre 2008 | G10: 2780.44 | H10: 20 | I10: =G10/1.2 -> 2317.0333333333333
A11: Contributo Comunale Febbraio 2009 | G11: 6834.38 | H11: 20 | I11: =G11/1.2 -> 5695.3166666666666
A12: TOTALE RICAVI | K12: =SUM(K8:K11) -> 8747.94
A14: COSTI
A15: MATERIALI PER CORSI | G15: Lordo | H15: Iva | I15: Netto | K15: =SUM(I16:I18) -> 726.66666666666674
A16: Materiali per corsi di Musica | G16: 633 | H16: 20 | I16: =G16/1.2 -> 527.5
A17: Materiali per corsi di pittura adulti | G17: 200 | H17: 20 | I17: =G17/1.2 -> 166.66666666666669
A18: Materiali per corsi di pittura ragazzi | G18: 39 | H18: 20 | I18: =G18/1.2 -> 32.5
A19: Strumenti e attrezzature | G19: Lordo | H19: Iva | I19: Netto | K19: =SUM(I20:I24) -> 2290
A20: Stampante/Fotocopiatrice A3 | G20: 298 | H20: 20 | I20: =G20/1.2 -> 248.33333333333334
A21: Accordatura e sistemazione pianoforte | G21: 200 | H21: 20 | I21: =G21/1.2 -> 166.66666666666669
A22: Batteria Nuova | G22: 1050 | H22: 20 | I22: =G22/1.2 -> 875
A23: Casse attive | G23: 600 | H23: 20 | I23: =G23/1.2 -> 500
A24: Revisione straordinaria pianoforte | G24: 600 | H24: 20 | I24: =G24/1.2 -> 500
A25: PUBBLICITA' | G25: Lordo | H25: Iva | I25: Netto | K25: =SUM(I26:I26) -> 1285.8333333333335
A26: Opuscolo informativo | G26: 1543 | H26: 20 | I26: =G26/1.2 -> 1285.8333333333335
A27: SAGGI | G27: Lordo | H27: Iva | I27: Netto | K27: =SUM(I28:I29) -> 790
A28: Noleggio pianoforte | G28: 348 | H28: 20 | I28: =G28/1.2 -> 290
A29: Auditorium | G29: 600 | H29: 20 | I29: =G29/1.2 -> 500
A30: Consulenza fiscale e servizio paghe | K30: =SUM(I31:I32) -> 2072
A31: Consulenza fiscale | G31: 1248 | I31: 1048
A32: Servizio Paghe | G32: 1224 | I32: 1024
A33: TELEFONICHE E POSTALI | K33: =SUM(I34:I34) -> 307.7
A34: Ricariche omnitel e spese postali | I34: 307.7
A35: CANCELLERIA | K35: =SUM(I36:I36) -> 882.33333333333337
A36: Carta, toner, cartucce per fotocopiatrice e stampanti | G36: 1058.8 | H36: 20 | I36: =G36/1.2 -> 882.33333333333337
A37: SCONTO BANDA MARIANO | K37: =SUM(I38:I38) -> 0
A38: Nessuno sconto | I38: =G38/(1+H38/100) -> 0
A39: SPESE VARIE GESTIONE SCUOLA | K39: =SUM(I40:I40) -> 340.79166666666669
A40: Cancelleria, chiavi serrature e varie | G40: 408.95 | H40: 20 | I40: =G40/1.2 -> 340.79166666666669
A41: IMPOSTE E TASSE | K41: =SUM(I42:I43) -> 96.749126250000018
A42: IRAP su contributo comuanle gestione scuola (3/100*4,25/100) | I42: =K9*3/100*4.25/100 -> 10.21574625
A43: IRPEG su contributo comunale gestione scuola (3/100*36/100) | I43: =K9*3/100*36/100 -> 86.533380000000022
A44: TOTALE COSTI | K44: =SUM(K15:K43) -> 8792.0741262499996
A46: RIEPILOGO
A47: TOTALE RICAVI | E47: =SUM(K12) -> 8747.94 | F47: TOTALE COSTI | K47: =K44 -> 8792.0741262499996
A48: CONTRIBUTO COMUNALE A SALDO | E48: =K47-E47 -> 44.134126249999099
A50: Totale contributo comunale | E50: =K12+E48 -> 8792.0741262499996